{
  "schema_version": "1.0.0",
  "id": "id-example-0001",
  "created_at": "2026-07-26T12:00:00Z",
  "correlation_id": "correlation_id-example-0001",
  "trace_id": "trace_id-example-0001",
  "approval_request_id": "approval_request_id-example-0001",
  "run_id": "run_id-example-0001",
  "decision": "approved",
  "request_digest": "sha256:aaaaaaaaaaaaaaaaaaaaaaaaaaaaaaaaaaaaaaaaaaaaaaaaaaaaaaaaaaaaaaaa",
  "granted_scopes": [],
  "decided_by": "decided_by-example-0001",
  "decision_version": 1,
  "expires_at": "2026-07-26T12:00:00Z"
}
